{
  "name": "places/ChIJN1t_tDeuEmsRUsoyG83frY4",
  "widthPx": 720,
  "heightPx": 720,
  "authorAttributions": [
    {
      "displayName": "Googleplex",
      "uri": "https://maps.google.com/?cid=12345678901234567890",
      "photoUri": "https://places.googleapis.com/v1/places/ChIJ/photos/AeJ/media"
    }
  ]
}